{
  "schema_version": "1.0.0",
  "library_id": "develop-principle",
  "title_zh": "工业级 Skill 开发原则知识库",
  "title_en": "Industrial Skill Development Principle Knowledge Base",
  "purpose_zh": "为开发 skill 的 agent 提供低上下文消耗、可检索、可测试、可量化的工程化理论和执行资产。",
  "purpose_en": "Provides agent-first, low-context, searchable, testable, and measurable engineering knowledge for industrial skill development.",
  "root_definition": {
    "id": "concept.skill",
    "summary_zh": "Skill 是面向 agent 的可复用能力包，包含触发条件、行为协议、支撑材料、控制边界、测试资产、量化指标和生命周期规则。",
    "summary_en": "A skill is a reusable agent capability package containing trigger rules, behavior protocol, supporting materials, control boundaries, test assets, quantitative metrics, and lifecycle rules."
  },
  "coverage": [
    {
      "goal_id": "goal.industrial_design",
      "title_zh": "工业级 skill 的设计思路和标准",
      "primary_docs": ["doc.architecture.industrial_skill_design"],
      "primary_nodes": ["pillar.design", "principle.progressive_disclosure", "principle.executable_acceptance", "anti_pattern.prompted_architecture"]
    },
    {
      "goal_id": "goal.testing_process",
      "title_zh": "skill 的测试流程应该如何设计",
      "primary_docs": ["doc.testing.skill_testing_process"],
      "primary_nodes": ["pillar.testing", "procedure.test_pyramid", "procedure.trajectory_eval", "procedure.regression_suite"]
    },
    {
      "goal_id": "goal.tdd_planning",
      "title_zh": "TDD 测试应该如何规划来测试 skill",
      "primary_docs": ["doc.testing.tdd_for_skill_development"],
      "primary_nodes": ["pillar.tdd", "procedure.red_green_refactor_for_skill", "technique.contract_test", "technique.mutation_test"]
    },
    {
      "goal_id": "goal.quant_metrics",
      "title_zh": "量化 skill 指标应该如何实践",
      "primary_docs": ["doc.metrics.quantitative_skill_metrics"],
      "primary_nodes": ["pillar.metrics", "metric.task_success_rate", "metric.activation_precision", "metric.pass_k", "metric.cost_per_success"]
    },
    {
      "goal_id": "goal.low_context_kb",
      "title_zh": "低上下文、多轮工业化开发知识库基础设施",
      "primary_docs": ["doc.operations.knowledge_base_architecture", "doc.operations.local_retrieval_workflow"],
      "primary_nodes": ["pillar.kb_architecture", "principle.short_node_budget", "principle.id_references", "pattern.progressive_loading"]
    },
    {
      "goal_id": "goal.lifecycle_management",
      "title_zh": "工业级 skill 生命周期、发布、版本、观测和回滚",
      "primary_docs": ["doc.operations.skill_lifecycle_management"],
      "primary_nodes": ["pillar.lifecycle", "procedure.release_gate", "procedure.rollback_plan", "procedure.deprecation_policy", "pattern.skill_registry"]
    },
    {
      "goal_id": "goal.research_collection",
      "title_zh": "工业级 skill 的资料搜集、证据基础和来源可溯源",
      "primary_docs": ["doc.research.evidence_driven_skill_research"],
      "primary_nodes": ["pillar.research", "procedure.source_roster", "procedure.search_fan_out", "procedure.iterative_deepening", "procedure.triangulation", "principle.claim_evidence_traceability"]
    }
  ],
  "files": [
    {
      "id": "doc.architecture.industrial_skill_design",
      "path": "docs/architecture/industrial_skill_design.md",
      "kind": "long_doc",
      "tags": ["design", "architecture", "skill"]
    },
    {
      "id": "doc.testing.skill_testing_process",
      "path": "docs/testing/skill_testing_process.md",
      "kind": "long_doc",
      "tags": ["testing", "eval", "trajectory"]
    },
    {
      "id": "doc.testing.tdd_for_skill_development",
      "path": "docs/testing/tdd_for_skill_development.md",
      "kind": "long_doc",
      "tags": ["tdd", "edd", "tests"]
    },
    {
      "id": "doc.metrics.quantitative_skill_metrics",
      "path": "docs/metrics/quantitative_skill_metrics.md",
      "kind": "long_doc",
      "tags": ["metrics", "quantification", "observability"]
    },
    {
      "id": "doc.operations.knowledge_base_architecture",
      "path": "docs/operations/knowledge_base_architecture.md",
      "kind": "long_doc",
      "tags": ["kb", "context", "graph"]
    },
    {
      "id": "doc.operations.local_retrieval_workflow",
      "path": "docs/operations/local_retrieval_workflow.md",
      "kind": "long_doc",
      "tags": ["kb", "retrieval", "search", "index", "graph", "local"]
    },
    {
      "id": "doc.operations.skill_lifecycle_governance",
      "path": "docs/operations/skill_lifecycle_governance.md",
      "kind": "long_doc",
      "tags": ["lifecycle", "release", "governance"]
    },
    {
      "id": "doc.operations.skill_lifecycle_management",
      "path": "docs/operations/skill_lifecycle_management.md",
      "kind": "long_doc",
      "tags": ["lifecycle", "release", "versioning", "registry", "observability", "rollback"]
    },
    {
      "id": "doc.research.evidence_driven_skill_research",
      "path": "docs/research/evidence_driven_skill_research.md",
      "kind": "long_doc",
      "tags": ["research", "evidence", "collection", "breadth", "depth", "traceability", "source", "triangulation"]
    },
    {
      "id": "doc.research.skill_reference_library",
      "path": "docs/research/skill_reference_library.md",
      "kind": "long_doc",
      "tags": ["research", "registry", "github", "skill", "reference", "fetch", "learn"]
    },
    {
      "id": "doc.research.skill_engineering_reading_list",
      "path": "docs/research/skill_engineering_reading_list.md",
      "kind": "long_doc",
      "tags": ["research", "reading", "design", "testing", "tdd", "bibliography"]
    },
    {
      "id": "doc.research.skill_ops_reading_list",
      "path": "docs/research/skill_ops_reading_list.md",
      "kind": "long_doc",
      "tags": ["research", "reading", "metrics", "lifecycle", "governance", "context", "bibliography"]
    },
    {
      "id": "nodes.pillars",
      "path": "knowledge_graph/nodes/pillars.json",
      "kind": "node_file"
    },
    {
      "id": "nodes.core",
      "path": "knowledge_graph/nodes/core_nodes.json",
      "kind": "node_file"
    },
    {
      "id": "nodes.lifecycle",
      "path": "knowledge_graph/nodes/lifecycle_nodes.json",
      "kind": "node_file"
    },
    {
      "id": "nodes.research",
      "path": "knowledge_graph/nodes/research_nodes.json",
      "kind": "node_file"
    },
    {
      "id": "edges.core",
      "path": "knowledge_graph/edges/core_edges.json",
      "kind": "edge_file"
    },
    {
      "id": "edges.lifecycle",
      "path": "knowledge_graph/edges/lifecycle_edges.json",
      "kind": "edge_file"
    },
    {
      "id": "edges.research",
      "path": "knowledge_graph/edges/research_edges.json",
      "kind": "edge_file"
    },
    {
      "id": "refs.architecture",
      "path": "references/architecture.references.json",
      "kind": "reference_file"
    },
    {
      "id": "refs.testing",
      "path": "references/testing_tdd.references.json",
      "kind": "reference_file"
    },
    {
      "id": "refs.metrics",
      "path": "references/metrics_evaluation.references.json",
      "kind": "reference_file"
    },
    {
      "id": "refs.docs",
      "path": "references/documentation_context.references.json",
      "kind": "reference_file"
    },
    {
      "id": "refs.governance",
      "path": "references/governance_boundary.references.json",
      "kind": "reference_file"
    },
    {
      "id": "refs.lifecycle",
      "path": "references/lifecycle_operations.references.json",
      "kind": "reference_file"
    },
    {
      "id": "refs.research_methodology",
      "path": "references/research_methodology.references.json",
      "kind": "reference_file"
    },
    {
      "id": "refs.skill_engineering_extended",
      "path": "references/skill_engineering_extended.references.json",
      "kind": "reference_file"
    },
    {
      "id": "refs.skill_ops_extended",
      "path": "references/skill_ops_extended.references.json",
      "kind": "reference_file"
    },
    {
      "id": "registry.skill_repos",
      "path": "references/skill_repos.registry.json",
      "kind": "registry_file",
      "tags": ["registry", "github", "skill", "repos", "stars", "learn", "reference"]
    },
    {
      "id": "schema.node",
      "path": "schemas/node.schema.json",
      "kind": "schema_file"
    },
    {
      "id": "schema.reference",
      "path": "schemas/reference.schema.json",
      "kind": "schema_file"
    },
    {
      "id": "schema.skill_repo_registry",
      "path": "schemas/skill_repo_registry.schema.json",
      "kind": "schema_file",
      "tags": ["schema", "registry", "repos", "github", "skill"]
    },
    {
      "id": "schema.index",
      "path": "schemas/index.schema.json",
      "kind": "schema_file",
      "tags": ["schema", "index", "files", "coverage"]
    },
    {
      "id": "schema.search_aliases",
      "path": "schemas/search_aliases.schema.json",
      "kind": "schema_file",
      "tags": ["schema", "alias", "query", "retrieval"]
    },
    {
      "id": "schema.quality_gate",
      "path": "schemas/quality_gate.schema.json",
      "kind": "schema_file",
      "tags": ["schema", "quality", "gate", "threshold"]
    },
    {
      "id": "schema.quality_report",
      "path": "schemas/quality_report.schema.json",
      "kind": "schema_file",
      "tags": ["schema", "quality", "report", "coverage"]
    },
    {
      "id": "schema.summary_cards",
      "path": "schemas/summary_cards.schema.json",
      "kind": "schema_file",
      "tags": ["schema", "summary", "cards", "retrieval", "compressed"]
    },
    {
      "id": "schema.template_contracts",
      "path": "schemas/template_contracts.schema.json",
      "kind": "schema_file",
      "tags": ["schema", "template", "contract", "validation"]
    },
    {
      "id": "schema.query_effectiveness",
      "path": "schemas/query_effectiveness.schema.json",
      "kind": "schema_file",
      "tags": ["schema", "query", "retrieval", "testing"]
    },
    {
      "id": "schema.context_budget_rules",
      "path": "schemas/context_budget_rules.schema.json",
      "kind": "schema_file",